title,abstract
"Diabetes and Insulin Resistance","Diabetes mellitus is characterized by chronic hyperglycemia resulting from insulin resistance and impaired pancreatic beta-cell function. Studies show that long-term glucose dysregulation leads to vascular, renal, and neurological complications. Early diagnosis improves outcomes."
"Advances in Type 2 Diabetes Treatment","Type 2 diabetes affects millions globally. New therapeutic approaches, including GLP-1 agonists and SGLT2 inhibitors, have shown improved glycemic control. Lifestyle interventions remain essential for disease management."
"Hypertension and Cardiovascular Risk","Hypertension is a major contributor to stroke, myocardial infarction, and heart failure. Research highlights the benefits of early blood pressure screening and medication adherence to reduce long-term cardiovascular risk."
"Asthma Inflammatory Mechanisms","Asthma is a chronic inflammatory airway disorder marked by episodic wheezing and breathlessness. Recent findings indicate eosinophilic inflammation plays a central role in severe asthma phenotypes."
"Chronic Kidney Disease Progression","Chronic kidney disease involves gradual loss of renal function. Proteinuria, hypertension, and diabetes accelerate disease progression. Early nephrology referral improves patient outcomes."
"Peptic Ulcer Disease Causes","Peptic ulcer disease is strongly associated with Helicobacter pylori infection and prolonged NSAID use. Eradication therapy significantly reduces recurrence rates and ulcer complications."
"Respiratory Infection Trends","Respiratory infections remain among the leading causes of morbidity. Viral pathogens such as influenza and RSV contribute heavily to seasonal outbreaks."
"Liver Cirrhosis Complications","Liver cirrhosis results from chronic liver injury including viral hepatitis and alcohol misuse. Portal hypertension and ascites are common complications requiring long-term management."
"Thyroid Disorders and Metabolism","Thyroid hormones regulate metabolic activity. Both hypothyroidism and hyperthyroidism lead to systemic dysfunction, requiring prompt endocrine evaluation."
"Anemia and Iron Deficiency","Iron-deficiency anemia is the most prevalent anemia worldwide. Reduced dietary intake, malabsorption, and chronic blood loss are primary causes."
"Stroke Early Intervention","Rapid recognition of ischemic stroke symptoms significantly improves prognosis. Thrombolytic therapy within the therapeutic window reduces disability."
"COVID-19 Pulmonary Impact","COVID-19 has diverse clinical presentations ranging from mild respiratory illness to severe pneumonia and ARDS. Long-term effects include fibrosis and reduced lung capacity."
"Obesity and Metabolic Syndrome","Obesity increases risk for type 2 diabetes, hypertension, and dyslipidemia. Research supports the role of weight-loss interventions in reversing metabolic complications."
"Arthritis Autoimmune Mechanisms","Rheumatoid arthritis involves immune-mediated joint inflammation. Biological therapies targeting TNF-alpha and interleukin-6 have improved treatment outcomes."
"Depression and Neurobiology","Depression is linked to neurotransmitter imbalance and altered brain circuitry. Modern therapies focus on serotonin reuptake inhibition and cognitive behavioral methods."
"Anxiety Disorders Overview","Anxiety disorders are characterized by excessive worry, physiological arousal, and impaired functioning. Evidence supports behavioral therapy as a primary treatment."
"Chronic Back Pain Etiology","Chronic back pain commonly arises from degenerative disc disease, trauma, or muscular imbalance. Early physiotherapy reduces chronicity."
"Gastritis and H. Pylori","Gastritis involves inflammation of the stomach lining. H. pylori remains a major causative agent and eradication therapy improves recovery."
"Skin Rash Diagnostic Patterns","Skin rashes may arise from infections, allergic reactions, autoimmune diseases, or drug hypersensitivity. Clinical pattern recognition improves diagnosis accuracy."
"Migraine and Neurological Triggers","Migraine is a neurovascular disorder characterized by intense headache, aura, and sensory hypersensitivity. Genetics and environmental triggers play major roles."
"Heart Failure Research","Heart failure results from impaired cardiac pumping function. Novel therapies targeting neurohormonal pathways improve survival."
"Cholesterol and Atherosclerosis","Elevated LDL cholesterol contributes to plaque formation and vascular injury. Statin therapy significantly reduces cardiovascular events."
"Influenza Vaccine Efficacy","Seasonal influenza vaccination reduces infection severity and transmission. Novel vaccine formulations aim to improve long-term immunity."
"Pneumonia Clinical Management","Pneumonia can be bacterial, viral, or fungal. Empiric antibiotic therapy remains essential for community-acquired infections."
"Urinary Tract Infection Patterns","UTIs commonly affect women due to anatomical susceptibility. E. coli is the predominant pathogen, and recurrence is frequent."
"Chronic Fatigue Syndrome Research","Chronic fatigue syndrome presents with persistent tiredness, cognitive dysfunction, and unrefreshing sleep. Current research explores immune dysregulation and viral triggers."
"Allergy and Immune Response","Allergies occur due to hypersensitive immune response to environmental antigens. Histamine release leads to itching, swelling, and respiratory symptoms."
"Sinusitis and Nasal Inflammation","Sinusitis results from obstruction and inflammation of the paranasal sinuses. Antibiotics or corticosteroids may be required depending on severity."
"Dengue Fever Clinical Signs","Dengue fever is a mosquito-borne illness characterized by high fever, severe muscle pain, and rash. Prompt hydration reduces complications."
"Malaria Treatment Advances","Malaria remains a global health issue. Artemisinin-based therapy has significantly reduced mortality rates."
"Fungal Infection Mechanisms","Fungal pathogens cause infections ranging from superficial skin disease to systemic involvement. Immune suppression greatly increases risk."
"Vertigo and Vestibular Disorders","Vertigo arises from dysfunction of the inner ear or central pathways. Repositioning maneuvers are effective for positional vertigo."
"Bronchitis Acute vs Chronic","Bronchitis involves inflammation of bronchial tubes. Chronic bronchitis is often linked to smoking and long-term irritant exposure."
"Food Poisoning Outbreak Patterns","Foodborne illness is caused by bacterial toxins or infectious agents. Prevention requires proper food handling practices."
"Jaundice and Bilirubin Metabolism","Jaundice indicates elevated bilirubin levels due to liver disease, hemolysis, or biliary obstruction."
"Appendicitis Early Indicators","Appendicitis typically presents with abdominal pain, fever, and nausea. Delayed diagnosis increases risk of rupture."
"Chikungunya Symptoms Overview","Chikungunya virus causes fever, joint pain, and rash. Most patients recover fully but joint pain can persist."
"Mumps Complications in Adults","Mumps infection can lead to orchitis, meningitis, and pancreatitis in adults. Vaccination remains highly effective."
"Measles Transmission Dynamics","Measles is a highly contagious viral infection. Complications include pneumonia and encephalitis."
"Chickenpox and Immunity","Chickenpox is caused by varicella-zoster virus. Immunity after infection is typically lifelong."
"Tuberculosis Drug Resistance","Tuberculosis remains a major infectious killer. Drug-resistant strains require multi-drug therapy and careful monitoring."
"Hepatitis A–E Overview","Hepatitis viruses differ in transmission routes and clinical severity. Chronic hepatitis B and C can progress to cirrhosis."
"Inflammatory Bowel Disease","IBD includes Crohn’s disease and ulcerative colitis. Persistent inflammation leads to abdominal pain, diarrhea, and malabsorption."
"Diarrhea and Hydration Therapy","Diarrheal illness is a leading cause of childhood mortality globally. Oral rehydration therapy is life-saving."
"Dehydration Clinical Risks","Severe dehydration leads to electrolyte imbalance, kidney injury, and shock. Early fluid replacement is essential."
"Chronic Obstructive Pulmonary Disease","COPD causes airflow limitation due to chronic bronchitis or emphysema. Smoking cessation slows disease progression."
"Psoriasis Immune Pathways","Psoriasis is an autoimmune skin disorder characterized by red, scaly plaques. Biologic agents target TNF and IL-17 pathways."
"Pancreatitis Acute Management","Acute pancreatitis presents with severe abdominal pain and elevated pancreatic enzymes. Supportive care is primary treatment."
"Immunity and Vaccination Research","Vaccines stimulate adaptive immunity and reduce infectious disease burden. Booster schedules improve long-term protection."
"Blood Pressure Regulation Mechanisms","Blood pressure is maintained through cardiac output, vascular tone, and renal mechanisms. Dysregulation leads to hypertension."
"Kidney Infection Clinical Findings","Kidney infections (pyelonephritis) cause flank pain, fever, vomiting, and urinary symptoms. Prompt antibiotics prevent complications."
"Urinary Tract Infection in Women","UTIs commonly present with burning urination, frequent urge, and pelvic discomfort. E. coli is the most common pathogen."
"Anemia Causes and Diagnosis","Anemia results from blood loss, nutritional deficiency, or chronic disease. Symptoms include fatigue, shortness of breath, and pallor."
"Thyroid Disorders and Hormonal Imbalance","Thyroid dysfunction alters metabolism, leading to fatigue, weight change, and mood disturbances."
"Arthritis and Joint Inflammation","Arthritis causes swelling, stiffness, and joint pain. Rheumatoid arthritis involves autoimmune destruction of synovial tissue."
"Osteoporosis and Bone Density Loss","Osteoporosis weakens bones, increasing fracture risk. Calcium/Vitamin-D intake and weight-bearing exercise reduce risk."
"Stroke Warning Signs","Stroke symptoms include facial drooping, arm weakness, and speech difficulty. Rapid treatment improves outcomes."
"Heart Attack Common Symptoms","A heart attack typically presents with chest pain, sweating, nausea, and shortness of breath. Immediate intervention is critical."
"Hypertension Long-term Effects","Chronic high blood pressure damages arteries and increases risk of stroke, kidney failure, and heart attack."
"Anxiety Physical Symptoms","Anxiety disorders manifest as rapid heartbeat, sweating, dizziness, and shortness of breath due to sympathetic activation."
"Depression Clinical Profile","Depression presents with persistent sadness, fatigue, sleep disturbance, and loss of interest in daily activities."
"Migraine Headache Mechanisms","Migraines cause intense headache with nausea, light sensitivity, and visual disturbances due to neurovascular changes."
"Cluster Headache Characteristics","Cluster headaches are severe unilateral headaches with tearing and nasal congestion, occurring in cyclical patterns."
"Epilepsy Seizure Triggers","Epilepsy involves recurrent seizures from abnormal brain activity. Triggers include stress, flashing lights, and sleep deprivation."
"Parkinson’s Disease Pathology","Parkinson’s results from degeneration of dopaminergic neurons. Symptoms include tremor, rigidity, and slowed movement."
"Alzheimer’s Research Summary","Alzheimer’s disease causes memory loss and cognitive decline due to amyloid plaques and tau tangles."
"Obesity Metabolic Effects","Obesity increases risk of diabetes, hypertension, and fatty liver disease. Lifestyle change is key to treatment."
"COVID-19 Symptoms Update","COVID-19 presents with fever, cough, fatigue, and loss of smell. Severe cases cause respiratory distress."
"Asthma Airway Inflammation","Asthma causes wheezing, coughing, and breathing difficulty triggered by allergens or exercise."
"Pneumonia Clinical Manifestations","Pneumonia causes cough, fever, chest pain, and difficulty breathing due to lung inflammation."
"GERD Acid Reflux Symptoms","Gastroesophageal reflux leads to heartburn, chest discomfort, and chronic cough."
"Peptic Ulcer Causes","Peptic ulcers result from H. pylori infection or NSAID overuse. Symptoms include abdominal pain, nausea, and bloating."
"Irritable Bowel Syndrome Patterns","IBS causes abdominal cramps, bloating, and altered bowel habits without structural abnormalities."
"Gallbladder Disease Overview","Gallstones cause right-upper-quadrant abdominal pain, nausea, and vomiting. Surgery may be required."
"Viral Gastroenteritis","Viral gastroenteritis leads to vomiting, diarrhea, abdominal pain, and dehydration, often caused by norovirus or rotavirus."
